{
  "schemaVersion": "1.0.0",
  "jobId": "PB-20260825-0123456789",
  "occurrences": [
    {
      "occurrenceId": "88888888-8888-4888-8888-888888888888",
      "entityId": "77777777-7777-4777-8777-777777777777",
      "documentId": "55555555-5555-4555-8555-555555555555",
      "start": 0,
      "end": 4,
      "surfaceText": "測試人物",
      "sourceTextHash": "4444444444444444444444444444444444444444444444444444444444444444",
      "handling": "TOKENIZE",
      "riskFlags": [],
      "tokenApplied": true
    }
  ],
  "createdAt": "2026-08-25T08:00:00Z",
  "updatedAt": "2026-08-25T08:10:00Z"
}
